{
  "schema_version": "skill-contract.v3",
  "skill": {"id": "solution-design", "version": "3.3.0", "stage": "planning.design", "entrypoint": "SKILL.md"},
  "trust": {"manifest_schema": "package-manifest.v2", "canonicalization_policy_id": "bundle-canonical-windows.v1", "signature_policy_id": "skill-signature-ed25519.v1", "trust_store_id": "opencode-skill-trust.v1", "revocation_policy_id": "skill-revocation.v1", "registry_record_required": true, "atomic_install_required": true},
  "artifact_catalog": [
    {"name": "requirements_contract", "schema_id": "artifact.requirements_contract.v2", "producer": "skill"},
    {"name": "repository_context", "schema_id": "artifact.repository_context.v2", "producer": "guard"},
    {"name": "check_registry", "schema_id": "registry.checks.v2", "producer": "guard"},
    {"name": "path_policy", "schema_id": "policy.path_identity.v1", "producer": "guard"},
    {"name": "approved_pattern_registry", "schema_id": "registry.patterns.v1", "producer": "guard"},
    {"name": "architecture_fragment", "schema_id": "artifact.architecture_fragment.v2", "producer": "skill"},
    {"name": "impact_fragment", "schema_id": "artifact.impact_fragment.v2", "producer": "skill"},
    {"name": "pattern_fragment", "schema_id": "artifact.pattern_fragment.v2", "producer": "skill"},
    {"name": "solution_design", "schema_id": "artifact.solution_design.v2", "producer": "skill"},
    {"name": "question_set", "schema_id": "artifact.question_set.v2", "producer": "skill"},
    {"name": "question_response", "schema_id": "artifact.question_response.v1", "producer": "external_control"},
    {"name": "response_bundle", "schema_id": "artifact.question_response_bundle.v1", "producer": "guard"},
    {"name": "phase_gate_record", "schema_id": "artifact.phase_gate_record.v1", "producer": "guard"},
    {"name": "design_issue_set", "schema_id": "artifact.design_issue_set.v1", "producer": "guard"},
    {"name": "blocking_record", "schema_id": "artifact.blocking_record.v1", "producer": "skill"},
    {"name": "guard_blocking_record", "schema_id": "artifact.blocking_record.v1", "producer": "guard"},
    {"name": "applicability_evidence", "schema_id": "artifact.applicability_evidence.v1", "producer": "guard"}
  ],
  "lifecycle": {
    "public_states": ["PLANNING"],
    "steps": [
      {
        "step_id": "planning.design.architecture", "owner": "skill", "kind": "primary", "public_state": "PLANNING",
        "preconditions": ["requirements_frozen", "requirements_acceptance_covered", "check_registry_frozen"],
        "allowed_outcomes": ["completed", "clarification_required", "blocked"], "profile_ids": ["architecture"],
        "inputs": [{"artifact": "requirements_contract", "cardinality": "one", "source": {"kind": "artifact_ref", "authority": "skill", "producer_step_ids": ["planning.requirements.finalize"], "revision": "invocation_frozen", "digest": "required"}}, {"artifact": "check_registry", "cardinality": "one", "source": {"kind": "artifact_ref", "authority": "guard", "producer_step_ids": ["guard.freeze"], "revision": "invocation_frozen", "digest": "required"}}, {"artifact": "repository_context", "cardinality": "optional", "source": {"kind": "artifact_ref", "authority": "guard", "producer_step_ids": ["guard.freeze"], "revision": "invocation_frozen", "digest": "required"}}, {"artifact": "response_bundle", "cardinality": "optional", "source": {"kind": "artifact_ref", "authority": "guard", "producer_step_ids": ["planning.design.apply_response"], "revision": "invocation_frozen", "digest": "required"}}],
        "outputs_by_outcome": {
          "completed": [{"artifact": "architecture_fragment", "cardinality": "one", "source": "skill"}],
          "clarification_required": [{"artifact": "question_set", "cardinality": "one", "source": "skill"}],
          "blocked": [{"artifact": "blocking_record", "cardinality": "one", "source": "skill"}]
        },
        "exit_assertions_by_outcome": {
          "completed": ["architecture_fragment_valid", "component_ownership_drafted", "delivery_receipt_valid"],
          "clarification_required": ["question_set_valid", "delivery_receipt_valid"],
          "blocked": ["blocking_record_valid", "delivery_receipt_valid"]
        }
      },
      {
        "step_id": "planning.design.impact", "owner": "skill", "kind": "support", "public_state": "PLANNING",
        "preconditions": ["architecture_fragment_frozen", "repository_mode_existing", "repository_context_frozen", "path_policy_frozen"],
        "allowed_outcomes": ["completed", "blocked"], "profile_ids": ["impact"],
        "inputs": [{"artifact": "requirements_contract", "cardinality": "one", "source": {"kind": "artifact_ref", "authority": "skill", "producer_step_ids": ["planning.requirements.finalize"], "revision": "invocation_frozen", "digest": "required"}}, {"artifact": "architecture_fragment", "cardinality": "one", "source": {"kind": "artifact_ref", "authority": "skill", "producer_step_ids": ["planning.design.architecture"], "revision": "invocation_frozen", "digest": "required"}}, {"artifact": "repository_context", "cardinality": "one", "source": {"kind": "artifact_ref", "authority": "guard", "producer_step_ids": ["guard.freeze"], "revision": "invocation_frozen", "digest": "required"}}, {"artifact": "path_policy", "cardinality": "one", "source": {"kind": "artifact_ref", "authority": "guard", "producer_step_ids": ["guard.freeze"], "revision": "invocation_frozen", "digest": "required"}}],
        "outputs_by_outcome": {"completed": [{"artifact": "impact_fragment", "cardinality": "one", "source": "skill"}], "blocked": [{"artifact": "blocking_record", "cardinality": "one", "source": "skill"}]},
        "exit_assertions_by_outcome": {"completed": ["impact_fragment_valid", "impact_operation_set_closed", "path_objects_canonical", "delivery_receipt_valid"], "blocked": ["blocking_record_valid", "delivery_receipt_valid"]}
      },
      {
        "step_id": "planning.design.pattern", "owner": "skill", "kind": "support", "public_state": "PLANNING",
        "preconditions": ["architecture_fragment_frozen", "approved_pattern_present", "pattern_registry_frozen"],
        "allowed_outcomes": ["completed", "blocked"], "profile_ids": ["pattern"],
        "inputs": [{"artifact": "requirements_contract", "cardinality": "one", "source": {"kind": "artifact_ref", "authority": "skill", "producer_step_ids": ["planning.requirements.finalize"], "revision": "invocation_frozen", "digest": "required"}}, {"artifact": "architecture_fragment", "cardinality": "one", "source": {"kind": "artifact_ref", "authority": "skill", "producer_step_ids": ["planning.design.architecture"], "revision": "invocation_frozen", "digest": "required"}}, {"artifact": "approved_pattern_registry", "cardinality": "one", "source": {"kind": "artifact_ref", "authority": "guard", "producer_step_ids": ["guard.freeze"], "revision": "invocation_frozen", "digest": "required"}}],
        "outputs_by_outcome": {"completed": [{"artifact": "pattern_fragment", "cardinality": "one", "source": "skill"}], "blocked": [{"artifact": "blocking_record", "cardinality": "one", "source": "skill"}]},
        "exit_assertions_by_outcome": {"completed": ["pattern_fragment_valid", "approved_patterns_only", "delivery_receipt_valid"], "blocked": ["blocking_record_valid", "delivery_receipt_valid"]}
      },
      {
        "step_id": "planning.design.finalize", "owner": "skill", "kind": "aggregate", "public_state": "PLANNING",
        "preconditions": ["architecture_fragment_frozen", "required_design_fragments_resolved", "check_registry_frozen"],
        "allowed_outcomes": ["completed", "clarification_required", "blocked"], "profile_ids": ["finalize"],
        "inputs": [{"artifact": "requirements_contract", "cardinality": "one", "source": {"kind": "artifact_ref", "authority": "skill", "producer_step_ids": ["planning.requirements.finalize"], "revision": "invocation_frozen", "digest": "required"}}, {"artifact": "architecture_fragment", "cardinality": "one", "source": {"kind": "artifact_ref", "authority": "skill", "producer_step_ids": ["planning.design.architecture"], "revision": "invocation_frozen", "digest": "required"}}, {"artifact": "impact_fragment", "cardinality": "optional", "source": {"kind": "artifact_ref", "authority": "skill", "producer_step_ids": ["planning.design.impact"], "revision": "invocation_frozen", "digest": "required"}}, {"artifact": "pattern_fragment", "cardinality": "optional", "source": {"kind": "artifact_ref", "authority": "skill", "producer_step_ids": ["planning.design.pattern"], "revision": "invocation_frozen", "digest": "required"}}, {"artifact": "check_registry", "cardinality": "one", "source": {"kind": "artifact_ref", "authority": "guard", "producer_step_ids": ["guard.freeze"], "revision": "invocation_frozen", "digest": "required"}}, {"artifact": "response_bundle", "cardinality": "optional", "source": {"kind": "artifact_ref", "authority": "guard", "producer_step_ids": ["planning.design.apply_response"], "revision": "invocation_frozen", "digest": "required"}}],
        "outputs_by_outcome": {
          "completed": [{"artifact": "solution_design", "cardinality": "one", "source": "skill"}],
          "clarification_required": [{"artifact": "question_set", "cardinality": "one", "source": "skill"}],
          "blocked": [{"artifact": "blocking_record", "cardinality": "one", "source": "skill"}]
        },
        "exit_assertions_by_outcome": {
          "completed": ["solution_design_valid", "design_requirement_coverage", "component_ownership_complete", "slice_contract_complete", "communication_bounded", "correction_policy_bounded", "delivery_receipt_valid"],
          "clarification_required": ["question_set_valid", "delivery_receipt_valid"],
          "blocked": ["blocking_record_valid", "delivery_receipt_valid"]
        }
      },
      {